category,title,tag,address,phone,homepage,sum_info,detail_info
명소,김유신장군묘,김유신장군묘 삼국통일의주역 역사 신라 ,경주시 충효동 산 7-1,,,"김유신장군묘는 지름이 30m에 달하고, 봉분에 십이지신상을 새긴 둘레돌과 돌난간을 둘렀다.
무덤 둘레에 십이지신상을 조각하는 것은 통일신라 이후에 보이는 왕릉의 무덤양식이다.
후대에 흥무대왕(혹은 흥호대왕)으로 추존되었기에 김유신의 묘도 왕릉의 양식을 갖춰 꾸민 것으로 보인다.","금관가야의 왕손이었던 김유신은 가야가 신라에 병합되면서 인생을 치열하게 살았다.
15세에 용화향도를 이끄는 화랑으로 서라벌의 산천을 다니며 수련을 했다.
그로부터 20여년 후 고구려 낭비성 전투를 시작으로 김유신은 고구려, 백제와의 영토싸움이 치열했던 전장에서 무용담을 쌓아 나갔다.

그 중에서도 김춘추와의 끈끈한 인연을 만들었던 계기가 된 전투가 있다.
642년, 백제의 공격으로 신라 대야성이 함락되었다.
김춘추는 고구려에 군사요청을 하러 가면서 김유신에게 뒷일을 대비하라 부탁했고, 김춘추가 고구려에 붙잡히자 김유신은 결사대 3천을 꾸려 국경지역에서 고구려를 압박했다.
당장 신라와의 전투가 부담스러운 상황이었던 고구려는 김춘추를 풀어주게 되고, 이 일을 계기로 김춘추와 김유신은 서로의 든든한 파트너가 되었다.

한반도에 통일된 나라를 세우자는 대의를 공유했던 두 사람.
김유신은 진덕여왕이 후사 없이 죽자, 본래 왕으로 추대되었던 알천과 상의한 끝에 김춘추를 왕으로 추대했다.
660년에 신라의 최고 관직 상대등이 되었고, 그 해 백제를 멸망시켰다.
동반자 무열왕이 세상을 떠난 뒤, 그의 아들 문무왕과 함께 삼국통일의 위업을 달성했다.
673년 79세의 나이로 죽은 김유신은 후대에 그 업적을 기려 ‘흥무대왕’ 또는 ‘흥호대왕’으로 추존되었다.
치열하게 살았던 그는, 송화산 기슭의 야트막한 구릉에 잠들어 있다. 정문인 흥무문을 지나 잘 가꾸어진 산책로를 지나면 김유신묘와 만난다.

무덤은 신하의 묘치고는 거대하고 화려하다.
지름이 30m에 달하고, 봉분에 십이지신상을 새긴 둘레돌과 돌난간을 둘렀다.
무덤 둘레에 십이지신상을 조각하는 것은 통일신라 이후에 보이는 왕릉의 무덤양식이다.
후대에 흥무대왕(혹은 흥호대왕)으로 추존되었기에 김유신의 묘도 왕릉의 양식을 갖춰 꾸민 것으로 보인다.
?


관람시간 09:00-18:00(동절기 17:00까지)
관람료 성인 2,000원 / 군인,청소년 1,000원 / 어린이 500원"
명소,흥무공원,흥무공원 건강 공원 산책 김유신 장군묘 피크닉 장소,경상북도 경주시 충효동 9-2 ,,,,"김유신 장군묘에서 멀지 않은 곳에 피크닉 장소로 사랑받는 소공원이 있다.
흥무대왕으로 추존되었던 김유신 장군의 묘 인근에 있어 이름이 ‘흥무공원’이다.
김유신 장군묘 향하는 길이 ‘흥무로’였던 것처럼.
공원은 크지 않지만 넓은 잔디밭과 곳곳에 나무가 만들어주는 그늘이 있어 경주시민들이 애용하는 휴식 공간이다."
명소,흥무로,흥무로 김유신 장군 묘 벚꽃 소나무 숲 신라 역사,경상북도 경주시 흥무로,,,"지난 2007년 건설교통부에서 선정한 ‘한국의 아름다운 길 100선’중 한 곳으로 소개된 ‘흥무로’.
터미널에서 형산강을 건너는 다리 서천교를 지나 첫 교차로에서 우회전을 하면 흥무로와 바로 이어진다.","지난 2007년 건설교통부에서 선정한 ‘한국의 아름다운 길 100선’중 한 곳으로 소개된 ‘흥무로’.
터미널에서 형산강을 건너는 다리 서천교를 지나 첫 교차로에서 우회전을 하면 흥무로와 바로 이어진다.

아름다운 길로 선정된 이유는 봄날에 흥무로를 찾는다면 자연스레 알게 될 것이다.
도로 양쪽에 선 아름드리 벚나무가 가지끼리 맞닿아 하늘을 가려 아름다운 벚꽃터널이 완성된다.
벚꽃 만발하는 봄이면 수많은 상춘객들로 도로가 주차장이 되니 자전거나 도보여행이 자동차 여행보다 도리어 빠를 수 있다.
여름은 초록대로, 가을은 단풍대로 아름답다.

가을 한정 한 가지 볼거리가 더 있다.
흥무로에서 강변 둔치로 내려가면 ‘서천 억새군락지’가 조성되어 있다. 은빛 억새물결 속에서 가을 정취를 만끽해보자."
명소,흥덕왕릉,흥덕왕릉 통일신라 왕릉 천년의사랑이야기 멋진 솔숲 설화 신라 역사,경주시 안강읍 육통리 산 42,,,"-관람시간 : 정해진 시간 없음(야간 관람 어려움)
-관람료 : 무료","흥덕왕릉을 꼭 찾아야 하는 이유는 확실하다.
천년의 사랑을 품은 능, 주인이 확실한 몇 안 되는 왕릉, 멋진 솔숲을 가진 곳.

왕릉이 품은 ‘천년의 사랑이야기’부터 시작하자.
당나라에 다녀온 사신이 앵무새 한 쌍을 가져왔다. 암컷이 이내 죽어버렸는데, 홀로 남은 수컷은 밤낮으로 슬피 울었다.
왕은 홀로 된 새 앞에 거울을 두게 했는데 새는 거울 속 제 모습을 짝인 줄 알고 거울을 쪼다가 자신인 것을 알고는 구슬프게 울다 죽어 버렸다.
수컷 앵무새와 왕은 닮은꼴이었다.
즉위한 지 1년도 채 되지 않아 왕비를 잃었다.
신하들은 다시 왕비를 얻으라고 간청했지만 왕은, ‘새도 제 짝을 잃고 저리 슬피 우는데, 훌륭한 부인을 잃은 내가 어찌 다시 결혼을 한다는 말인가?’라며 후처를 얻지 않았다.
왕은 평생 죽은 부인을 가슴에 품고 살다가 사랑하는 부인의 능에 함께 잠들었습니다.
흥덕왕의 이야기다.?

흥덕왕릉은 무열왕릉과 함께 왕릉 중에서도 주인을 완벽하게 알 수 있었던 능이다.
왕릉 한 쪽에 귀부가 남아 있는데, 비편 조각의 판독결과 이곳이 흥덕왕릉임을 알 수 있었다.
왕릉은 통일신라 이후의 전형적인 왕릉의 형태로 무인상 한쌍과 문인상 한쌍, 네 귀퉁이의 돌사자, 봉분 둘레에 십이지신이 새겨진 호석과 난간을 둘렀다.
아주 잘 갖추어진 통일신라 왕릉의 모습을 흥덕왕릉에서 확인할 수 있다.

마지막으로 솔숲. 삼릉에 견줄만한 안강형 소나무 솔숲이 이곳 흥덕왕릉 초입에도 조성되어 있다.
흥덕왕과 부인의 사랑이야기를 되뇌며 호젓하게 산책하기 좋다."
명소,서악서원,서악서원 김유신 장군 전통 문화 체험 신라 역사,경상북도 경주시 서악2길 23 (서악동),,,"서악서원은 문화재 활용이 아주 활발하게 이루어지는 곳이다.
고택스테이를 할 수 있고, 다도체험, 전통의복체험, 전통문화체험, 고택음악회 등 다양한 문화체험, 공연이 펼쳐진다.","서악서원은 흥선대원군의 서원철폐령 때에도 훼철되지 않은 47곳의 서원 중 한 곳이다.
보통 서원은 조선시대 성리학자의 위패를 모시는데, 서악서원은 독특하게 신라시대의 위인 김유신과 최치원, 설총의 위패를 모신다.
1563년 경주 부윤 이정이 세웠고, 이후 임진왜란으로 불타 소실된 것을 광해군 대에 중창했다.
국가가 인정한 사액서원으로 인조 원년에 ‘서악’이라는 이름을 받았다.

구조는 전형적인 전학후묘의 배치로, 서원에 들어서면 먼저 누각 ‘영귀루’와 마주한다.
영귀루와 마주하는 곳에 강당인 ‘시습당’이 자리하고 양쪽에 기숙공간인 동재 절차헌과 서재 조설헌이 배치되어 있다.
시습당 뒤쪽에 신라 세 위인의 위패를 모신 ‘묘우’가 있다.

서악서원은 문화재 활용이 아주 활발하게 이루어지는 곳이다.
고택스테이를 할 수 있고, 다도체험, 전통의복체험, 전통문화체험, 고택음악회 등 다양한 문화체험, 공연이 펼쳐진다.
?


관람시간 09:00-18:00
관람료 무료
서악서원 문화체험 http://www.silla.or.kr/
고택스테이 문의 054-774-1950
고택스테이 홈페이지 http://www.gjgotaek.kr/"
명소,건천 편백나무숲,편백나무숲 피톤치드 힐링여행 숲길 산책 가족여행,경주시 건천읍 송선리 535-2번지(400m),,,"-메모 : 산내 방면 20번 국도를 따라가다 보면 편백나무 숲 이정표를 발견할 수 있다. 숲길 입구까지 경사는 제법 있지만 차량 접근이 가능하다. 5-6대 주차 가능한 공터가 있다.
-대중교통으로 가는 법 : 350번 버스 이용 / 송선1리달래창 정류장 하차 / 목적지까지 도보 약 20분","경주 건천으로 가면 피톤치드 듬뿍 안아올 수 있는 힐링 숲길이 있다.
송선리 단석산 자락에 자리한 ‘건천 편백나무 숲내음길’이다.
시원스레 줄기 뻗은 편백나무가 빽빽이 들어서 있다.
500여 미터의 산책로에 나무 데크가 설치되어 있고, 정자도 2곳 마련되어 머물기 좋다."
명소,도리마을 은행나무숲,도리마을 은행나무숲 영화 촬영지 명소 이국적 촬영 마을,경주시 서면 도리(도리1리) ,,,"-관람시간 및 관람료 : 정해진 관람시간 없음 / 무료 관람
-편의시설 : 주차 가능, 공중화장실 없음(인근의 도리1리새마을회관, 친환경농업교육원 화장실 이용가능)
-대중교통으로 가는 법 : 303번 버스 이용(일5회 운행) / 도리보건소 정류장 하차 / 목적지까지 도보 5분","경주 서쪽 끝자락 도리마을은 몇 해 전까지만 하더라도 알음알음 찾아가는 비경이었다.
은행나무숲이 슬슬 입소문을 타면서 이제는 경주 대표 가을명소 중 한 곳이 됐다.
묘목 판매를 목적으로 심은 은행나무들이 숲을 이루게 됐다.
열 맞춰 빽빽하게 나무를 심은 덕에 자작나무처럼 위로만 쭉 벋은 늘씬한 은행나무가 이국적인 정취를 뽐낸다.
사진작가들이 매해 이곳을 찾고, 웨딩촬영성지로도 불린다.
최근에는 은행나무 물들 때면 마을 주민들이 직접 먹거리 장터, 특산물 장터를 운영해 즐길 거리를 더하고 있다."
명소,경주 롤러장 CM스포츠타운,CM스포츠타운 롤러장 7080 감성 복고풍 볼링장 레트로 데이트,경상북도 경주시 광중길 97-1,054-624-0555,,2019년 인기리에 방영된 예능프로그램 ‘캠핑클럽’에서 핑클 멤버들이 롤러장을 찾아 화제가 되기도 했다.,"경주 용강동에 자리한 CM스포츠타운은 종합실내스포츠테마파크이다. 락볼링장, 미니게임장, 롤러장 등의 시설이 모여 있다. 2019년 인기리에 방영된 예능프로그램 ‘캠핑클럽’에서 핑클 멤버들이 롤러장을 찾아 화제가 되기도 했다. ?


이용시간 평일 10시~22시 /주말 11시~24시
이용가격 대인 11,000원 / 소인 9,000원"
명소,화랑의 언덕(JTBC 캠핑클럽 촬영지),캠핑클럽경주촬영지 촬영 화랑의언덕 피크닉 명소 명상바위 일출,경북 경주시 산내면 내일리 산261-1, 010-6302-7143,,"-이용시간 : 매일, 09시~18시
-입장요금 : 1인 2,000원 / 7세 이하 무료
-메모 : 주차 가능, 반려동물 동반가능, 피크닉 가능, 캠핑 불가)","경주 사람들에게는 OK목장, OK청소년수련원으로 익숙한 곳이 전파를 타니 또 새로운 느낌이다.
핑클 멤버들이 감탄에 감탄을 마다않던 푸른 초원. ‘경주 화랑의 언덕’.
화랑 김유신이 수련하며 검으로 바위를 갈랐다는 설화가 전하는 ‘단석산’ 정상부에 드넓은 언덕이 바로 그 곳이다.

귀를 열고 눈을 열고 온 손끝 발끝을 열어 화랑의 언덕을 만끽해보기.
화랑의 언덕을 바라보기 좋은 곳에 자리한 흰 벤치에 바람이 머물다 간다. 가만히 앉아 머물며 노래하는 바람의 목소리를 들어 본다.
온통 초록초록한 평원. 도심의 회색빛에 침침해진 눈이 개안하는 느낌이다.
발끝에 감각을 집중하며 풀밭을 거닐어 보자. 버석버석 재미난 촉감이다. 화랑의 언덕에서는 그렇게 오감을 깨우며 시간을 보내야 한다.

캠핑클럽 속 핑클이 그랬던 것처럼 화랑의 언덕에서 하룻밤을 보내면 더할 나위 없이 좋겠지만, 현재(2019년 10월 기준) 차박이나 캠핑, 텐트야영 등 1박은 불가능하다. 관람시간 내에 산책과 피크닉만 가능하니 참고하기 바란다. 화랑의 언덕과 함께 명상바위, 수정지, 양떼목장, ATV, 피크닉 테이블, 파크골프장 등의 시설을 이용할 수 있다.

화랑의 언덕과 함께 꼭 둘러봐야 할 포인트가 ‘명상바위’이다. 이정표가 있어 어렵지 않게 찾을 수 있다. 캠핑클럽에서 효리와 진이 눈물나도록 아름다운 일출을 보았던 바로 그 장소이다. 일출 뿐만 아니라 명상바위에서 내려다보는 전망이 백만 불짜리이다. 명상바위에 오르면 발 밑으로 내남면 비지리 학동마을의 다랭이논 풍경을 마주할 수 있다."
명소,무열왕릉,무열왕릉 김춘추 태종 무열왕 귀부 신라 김유신 선덕여왕 역사,경주시 서악동 842,054-750-8614,,"-관람시간 : 3월-10월 09:00-18:00 / 11월-2월 09:00-17:00
-관람료 : 성인 2,000원 / 군인·청소년 : 1,000원 / 어린이 500원","신분의 불리함을 극복하고 최초의 진골 출신 왕이 되었던 김춘추, 신라 왕실에서 유일하게 묘호와 시호를 함께 가진 태종 무열왕이다.
김유신과 함께 삼국통일의 기반을 다진 왕. 김유신은 떡잎부터 그를 알아보고 김춘추의 킹메이커가 되기로 결심했다.
모든 것은 계획대로, 김유신의 김춘추 사로잡기 프로젝트가 시작된다.
어느 날 김유신은 김춘추와 함께 축국(현재의 축구) 시합을 하다가 실수를 가장한 고의로 춘추의 옷고름을 밟아 떨어지게 했다.
옷을 수선해주겠다며 집으로 초대한 유신은 두 누이에게 김춘추의 옷을 고쳐달라고 하는데, 언니 보희를 대신해 문희가 그의 옷을 집어 들었다.
이것을 인연으로 문희는 김춘추의 아이를 갖게 된다.
김춘추가 문희와의 결혼을 주저하자, 김유신은 아비 없는 아이를 가졌다는 이유로 동생을 화형에 처하겠다며 소동을 벌였다.
깜짝 놀라 달려온 김춘추는 아이의 아버지임을 고백하고 문희와 결혼하였다. 사돈 지간이 된 두 남자, 일적으로도 사적으로도 끈끈한 사이가 되었다.

태종 무열왕의 능은 주인이 확실한 왕릉 중 한 곳이다. 왕릉과 멀지 않은 곳에 비석을 세웠던 돌 거북(귀부)과 비석 위에 올리는 머릿돌(이수)이 남아 있다.
이 머릿돌에 ‘태종무열대왕지비(太宗武烈大王之碑)’라는 글씨가 새겨져 있어 이곳이 무열왕의 능임을 알 수 있었다.
무열왕릉 영역 안에는 왕릉 뒤편으로 ‘서악동고분군‘으로 부르는 거대한 고분4기가 일렬종대로 늘어서 있다.
무열왕릉부터 서악동고분군까지 거닐기 좋게 산책로를 잘 가꾸어 놓았으니 여유롭게 거닐어 보자."
명소,독락당,독락당 옥산서원 역사 유적지 회재 이언적 고택 스테이,경상북도 경주시 안강읍 옥산서원길 300-3,054-774-1950,,"독락당에서는 고택스테이가 가능하다.
이곳에서 하룻밤 머물며 자연을 벗 삼아 깊이 있는 휴식을 취해 보자.","자연과 벗 되었기에 홀로 있어도 외롭지 않은 집, 독락당은 회재 이언적 선생이 낙향하여 7년 간 기거한 곳이다.
가옥의 사랑채를 독락당, 또는 옥산정사라 부른다.

옥산정사라는 현판은 퇴계이황의 글씨, 독락당 현판은 아계 이산해의 글씨이다.
독락당의 포인트 하나, 독락당에 딸려 있는 별당 정자인 ‘계정’이다.
이곳에서 내려다보이는 계곡의 풍광이 한 폭의 한국화를 보는 듯하다.

또 하나의 포인트, 독락당과 계곡 사이의 담장에 살창을 설치한 모습이다.
독락당에 앉아서도 계곡의 풍경을 오롯이 감상할 수 있도록 했다.
바깥 경치를 집안으로 끌어온 선조의 지혜가 엿보인다.

독락당에서는 고택스테이가 가능하다.
이곳에서 하룻밤 머물며 자연을 벗 삼아 깊이 있는 휴식을 취해 보자.
?


관람시간 정해진 시간 없음
관람료 무료
고택스테이 문의 010-7620-7712
고택스테이 홈페이지 https://독락당.com/"
명소,옥산서원,옥산서원 이언적 유네스코 세계문화유산 한국의서원 다도 체험,경상북도 경주시 안강읍 옥산서원길 216-27,054-762-6567,,"관람시간 : 09:00-18:00(10~3월 17:00까지)??
휴관일 : 연중무휴
관람료 : 무료
문화해설시간 : 10:30-16:00(점심시간 12:00-13:00)?

<옥산서원 다도체험>?
운영일 : 5-10월 매주 주말(토,일요일)?
운영시간 : 11:00-17:00
체험비 : 무료?

주차정보 : 전용 주차장(무료) 이용","2019년 7월, 한국의 서원으로 유네스코 세계문화유산에 등재된 9곳의 서원 중 한 곳인 옥산서원.
회재 이언적 선생의 학문과 덕행을 기리고자 건립되었다.
정문인 역락문을 통해 들어가면 누각 ‘무변루’가 보이는데, 누마루를 서원 건축에 도입한 최초의 사례로 소개된다.

정면에 강당인 ‘구인당’이 있고, 좌우에 기숙공간인 민구재와 암수재가 자리하고 있다.
구인당에는 두 개의 ‘옥산서원’ 편액이 걸려 있는데,
강당 대청 전면에 있는 편액은 사액 받은 당시의 편액이고, 강당 전면에 걸린 편액은 조선 명필 ‘추사 김정희’의 글씨이다.

강학 공간 뒤에는 이언적 선생의 위패가 모셔진 사당을 비롯해, 신도비, 전사청 등이 배치되어 있다.
전형적인 전학후묘의 배치이다.

옥산서원에서는 매년 5월부터 10월까지 문화재활용사업의 일환으로 주말마다 무료 다도체험 프로그램을 진행한다."
명소,박목월 생가,박목월 생가 경주의문학인 청록파 시인 문학 지식,경상북도 경주시 건천읍 행정길 61,054-772-3077 ,http://dml.gyeongju.go.kr/?c=2/13/30 ,"관람시간 : 09:00-18:00(동절기 17:00까지)
휴관일 : 매주 월요일, 1월 1일, 설 및 추석 당일
관람료 : 무료
주차정보 : 전용주차장(무료) 이용","조지훈, 박두진과 함께 청록파 시인의 대표주자인 박목월 선생은 경주 건천읍 모량리에서 태어났다.
20대의 대부분을 경주에서 보내면서 문학 활동을 펼친 것으로 알려졌다.
그는 자연과의 교감과 향토적 서정의 세계, 우리의 전통적 선율을 살린 시를 많이 써서 북에는 ‘소월’, 남에는 ‘목월’이라는 평가를 받기도 했다.
?
윤사월 ?박목월
송화가루 날리는
외딴 봉우리
윤사월 해 길다
꾀꼬리 울면
산지기 외딴 집
눈 먼 처녀사
문설주에 귀 대이고
엿듣고 있다.
?
박목월이 고향집을 떠올리며 지은 시 ‘윤사월’이다. 시의 배경이 된 목월 선생의 생가가 지난 2014년 모량리 집터에 복원되었다.
시낭송장을 비롯해 안채와 사랑채, 디딜방아 등이 생가를 구성하고 있다.
선생의 유품인 친필 원고지, 액자, 가방, 책, 필기구 등도 함께 전시되어 있다. 이곳에서 목월 선생의 발자취를 좇아 보자."
명소,양동마을,양동마을 유네스코세계문화유산 전통 문화 체험 역사 마을 문화유산,경상북도 경주시 강동면 양동마을길 138-18,054-762-2630 ,http://yangdong.invil.org/,"<양동마을>
이용시간 : 09:00-19:00(10~3월 18:00까지)
휴장일 : 연중무휴?
이용료 : 성인 4,000원 / 청소년, 군인 2,000원 / 어린이 1,500원

<양동마을 문화관>?
관람시간 : 09:00-17:00
휴관일 : 매주 월요일?
관람료 : 무료?

주차정보 : 전용 주차장(무료) 이용","안동의 하회마을과 함께 한국의 역사마을로 지난 2010년 8월 세계문화유산에 등재되었다.
마을의 주산인 설창산의 봉우리에서 네 줄기로 능선과 골짜기가 뻗어 내려와 물(勿)자 형태를 이루고 있는데, 이 골짜기에 160여 호의 고와가(古瓦家)와 초가(草家)가 모여 있다.

양동은 월성 손씨와 여강 이씨의 자손들이 모여 사는 집성촌이다.?
마을의 산세와 지세가 명당 중의 명당이라 예로부터 재물과 인재가 모여들었다 한다.
그를 증명하듯 조선시대에는 과거급제자가 116명이나 나왔고, 우재 손중돈 선생, 회재 이언적 선생 등 명망 있는 관료와 학자를 배출하기도 했다.

주요 고택으로는 회재 이언적 선생에게 왕이 하사한 집 ‘향단’, 월성 손씨의 종택인 ‘서백당’(송첨종택), 회재 이언적 선생의 부친이 기거하던 집 ‘무첨당’, 우재 손중돈 선생이 분가하여 살았던 ‘관가정’등이 있다.

매년 봄부터 가을까지 양동마을 전통문화의 보존과 활용을 위해 ‘양동마을 전통문화체험 프로그램’이 운영된다."
명소,황성공원,황성공원 김유신 장군 기마상 산책 공원,경주시 원화로 431-12,054-750-8554,,"편의시설 : 공중화장실, 정자, 벤치, 무료 공공와이파이(골든파이 경주)
주차정보 : 경주시립도서관 인근(황성동 371-2, 무료), 경주실내체육관 인근(황성동 1041-1) 이용","황성공원은 도심 속 힐링 공간으로 경주시민과 관광객의 사랑을 지속적으로 받고 있다.
삼릉에 뒤지지 않는 멋스러운 소나무와 수 백 년 수령을 자랑하는 고목이 어우러져 울창한 숲을 이룬다.

여름이면 솔숲 산책로에 맥문동 군락이 조성되어 수려한 풍광을 더해주고,
가을이면 느티나무, 상수리나무, 떡갈나무 고목이 아늑하게 물든다.
황성공원 중간에 솟아오른 동산에 자리한 김유신 장군 기마상도 볼거리다."
음식,연화바루,한식 사찰요리 이색 무열왕릉 맛집,경주시 대경로 4827,054-774-5378,,"대표메뉴 : 바루 특정식 1인 18,000원 / 산채비빔밥 정식 8,000원 / 녹두전, 감자전 10,000원 / 버섯탕수이 15,000원
영업시간 : 12:00-21:00
휴무일 : 둘째, 넷째 월요일
주차 : 전용 주차장 이용","사찰음식은 고기와 오신채를 쓰지 않는 것이 특징이다.
스님들이 고기를 먹지 않는다는 것은 익히 알려진 사실인데 '오신채'는 무엇일까?
오신채란, 향이 강하고 맛이 자극적인 다섯가지의 채소를 뜻한다.
지역과 시대에 따라 다르긴 하지만 마늘, 파, 달래, 부추, 무릇(흥거) 등 다섯 가지의 채소를 말한다. 수행하는 마음이 어지러워지지 않게 하고자 금하는 식재료들이다.

무열왕릉 인근의 '연화바루'도 고기와 오신채를 쓰지 않는 사찰음식점이다.
연화는 연꽃을 뜻하고, '바루(발우)'는 스님들이 밥을 먹는 목기를 뜻한다.
제법 역사가 깊은 곳으로 지역의 스님들도 많이 다녀가는 곳이다.

버섯탕수이, 야채전요리, 채소쌈, 쥐눈이콩 된장찌개 등 코스로 사찰음식을 맛볼 수 있는 연화바루 특정식이 준비되어 있다.
또, 산나물 여러 가지와 천연 발효 장아찌들이 함께 내어지는 산채비빔밥 정식은 부담 없이 즐기기 좋다.
단품요리로 녹두전과 감자전, 버섯탕수이, 콩고기찜도 있다. 전체적으로 간이 세지 않고 뒷맛이 깔끔한 건강한 밥상이다."
