category,title,tag,address,phone,homepage,sum_info,detail_info
명소,대릉원 돌담길,대릉원돌담길 봄 명소 벚꽃 꽃 산책 데이트 ,경주시 태종로 783,,,"이용정보 : 황남빵 본점(태종로 783)부터 대릉원 정문(황남동 53)까지 이어지는 돌담길?
이용시간 : 정해진 이용 시간 없음?
주차정보 : 대릉원 공영주차장(황남동 53, 유료), 노동공영주차장(태종로767, 유료), 쪽샘임시주차장(원화로 181번길 진입, 무료) 이용","23기의 크고 작은 고분이 옹기종기 모여 있는 고분공원 대릉원.
황남대총, 천마총, 미추왕릉, 목련나무 포토존 등 대릉원 안에도 볼거리가 차고 넘치지만, 대릉원에서 즐길 한 가지 요소가 더 있다.
대릉원 영역을 두르고 있는 돌담을 따라 거니는 고즈넉한 걷기길, '대릉원 돌담길'이다.?

대릉원 후문 인근 황남빵 특산품매장 건너편에서 시작해 돌담을 따라 550여m를 거닐다보면 대릉원 정문에 닿는다.
이 길은 벚꽃이 피는 봄날 특히 아름답다. 길 처음부터 끝까지 벚나무 가로수가 식재되어 있어 아름다운 벚꽃터널을 만든다.
돌담 위로 빼꼼히 고개를 내민 고분의 봉긋한 머리와, 기와담장 밑 돌담, 그리고 벚꽃을 담는다면 완벽한 한 장의 사진이 된다."
명소,토함산,토함산 정상 토함산일출 경주토함산 산 일출 건강,경북 경주시 진현동 973-8,,,"<토함산 등반 안내>
주요 코스?
?? 풀코스 : 불국사 - 석굴암 - 토함산 정상
? ?단축 코스 : 석굴암 -?토함산 정상
소요시간??
?? 풀코스 :?편도 약 1시간?30분 소요(3.6km)
? ?단축코스 : 편도 약 25분-30분 소요(1.4km)
주차정보 : 석굴암 공영주차장(유료) 이용","날 좋은 날, 운이 좋으면 저 멀리 수평선을 내다볼 수 있을 정도로 동해와 가깝게 자리한 경주 토함산.
바다 가까이 있어 산에 안개가 자주 끼는데, 바다 쪽에서 밀려오는 안개를 산이 마시고 토해 내는듯한 모습을 표현해 ‘토함산(吐:토할 토, 含:머금을 함, 山:뫼산)’이라 부르게 되었다.
경주의 단석산에 이어 두 번째로 높은 산(745m)이고 신라인들이 신성시 여겼던 다섯 곳의 산악, 오악(五岳)중의 한 곳이다.
불국사, 석굴암 등 찬란한 신라 불교미술의 유산을 품은 산으로도 잘 알려져 있다.

풍채 좋은 산세와 이름 난 문화유산은 물론 토함산에서 꼭 경험해야할 또 하나의 요소, 일출이다.
모습을 드러낸 해가 토함산의 이웃 산 능선을 굽이굽이 먼저 밝히고, 이내 토함산 정상에 빛이 찾아든다.
어느 날에 봐도 장엄한 광경이다."
명소,경주 풍력발전(바람의언덕),경주풍력발전소 경주풍력발전 바람의언덕 명소 일몰 산책,경상북도 경주시 양북면 불국로 1056-185,054-777-6652,,"이용시간 : 정해진 이용시간 없음
이용료 : 무료
주차정보 : 전용 주차장 이용","토함산의 이웃산인 조항산 정상부에 경주 풍력발전이 자리해 있다.
친환경 청정에너지 생산을 위해 한국동서발전과 동국S&C가 건설한 상업용 풍력발전단지로 총 7기의 풍력발전기가 가동 중이다.
1만여 가구가 쓸 수 있는 양인 평균 4만 mwh 정도의 전력을 연간 생산한다.
산 능선을 따라 띄엄띄엄 거대한 풍력발전기가 세워져 있는데 ‘바람의 언덕’으로 부르는 이 일대를 365일 일반에 개방하고 있다.
풍력발전소가 한 눈에 내려다보이는 정자 ‘경풍루’가 있는 전망대와 함께 바람길 산책로, 피크닉테이블 존 등이 갖추어져 있다.

경주풍력발전 ‘바람의언덕’은 일몰, 노을이 아름다운 곳으로 알려져 있다.
해질녘 찾아보길 권한다. 전망대, 바람길 산책로 등 곳곳에서 석양을 감상하기 좋다.
더러는 일몰 후 조금 더 기다려 별빛 쏟아지는 낭만적인 밤까지 즐기고 가는 이들도 많다."
명소,영지&영지석불좌상,영지 아사달 아사녀 호수 역사 설화 역사,경북 경주시 외동읍 괘릉리 1261-1,,,"영지석불좌상 위치 : 경주시 외동읍 영지로 622-6
관람시간: 정해진 관람시간 없음
관람료 : 무료
편의시설?: 데크 산책로, 파고라형 벤치
주차정보 : 영지 공용주차장(외동읍 괘릉리 산 58-1, 무료) 이용","백제의 이름 난 석공 아사달이 석탑 제작을 위해 신라를 찾았다.
불국사에서 혼신의 힘을 다해 다보탑을 올렸고, 석가탑을 만드는 중이었다.
그의 부인 아사녀는 오매불망 기다리던 남편이 오지 않자 서라벌로 왔다. 그러나 탑이 완성되기 전에는 남편을 보지 못한다는 이야기를 듣고 돌아섰다.
탑이 완성되면 그림자가 비칠 것이라고 들은 못가에서 하염없이 남편을 기다리는 아사녀. 일렁이는 물결에 남편의 환상을 본 아사녀는 그리움에 사무쳐 못에 뛰어들었다.
마침내 석가탑까지 완성한 아사달은 부인이 왔다는 소식을 뒤늦게 전해 듣고 못가로 달려갔다. 그 곳에서 아내의 죽음을 알게 된 아사달.
넋 놓아 울던 그는?근처의 큰 바위를 만지기 시작했고, 바위는 아사녀를 닮은 불상이 되어 갔다. 불상을 완성한 그는 사랑하는 부인의 뒤를 따랐다.
그 후로 못은 그림자 연못이라는 뜻의 ‘영지’라 부르게 되었고, 못 인근의 소나무 숲에 아사달이 아사녀를 위해 만들었다는 불상 ‘영지석불좌상’이 자리해 있다.

아사달과 아사녀의 애절한 사랑의 장소, 영지 둘레를 따라 거닐 수 있는 산책로가 조성되어 있다.
영지둘레길과 500여 미터 떨어진 곳에 아사달이 아사녀를 그리며 만들었다는 영지석불좌상도 있으니 함께 둘러보는 것을 추천한다."
명소,불국사 박물관,불국사 박물관 박물관 불국사의자취 불국사성보박물관 수장고 신라 천년 불교예술 불교 역사,경주시 불국로 385,054-745-2100,http://bulguksa.or.kr,"관람시간 : 09:00-18:00(동절기 17:00까지)
휴관일 : 매주 월요일, 1월 1일, 설 및 추석 당일
관람료 : 성인 2,000원 / 청소년 및 어린이 1,000원 (불국사 관람료 별도)
불국사 관람료 : 성인 6,000원 / 청소년,군인 4,000원 / 어린이 3,000원
주차정보 : 불국사 정문주차장(진현동 산70-1, 유료), 불국사 공영주차장(불국로 873-243,유료) 이용","20여 년 전부터 시작된 박물관 건립 사업이 마침내 결실을 맺어 지난 2018년 11월 불국사 성보 문화재를 전시한 박물관이 개관했다.
국보로 지정된 석가탑 사리장엄을 비롯해 사찰에서 소장하고 있는 다양한 불교 미술품과 기증유물까지 만날 수 있는 불교문화 박물관이다.
박물관은 3,500여 평의 대지에 지하1층, 지상1층으로 지어졌다.
전시실과 함께, 유물을 보관하는 수장고와 연구가 이뤄지는 학예연구실, 도서자료실 등이 함께 마련되었다.

전시는 크게 4구역으로 나뉜다.
불국사의 역사를 시간의 흐름에 따라 보여주는 전시실을 시작으로, 국보 제126호로 지정된 석가탑 사리장엄의 진품을 만날 수 있는 전시실, 불상과 불화를 테마로 한 전시실, 마지막으로 학산 남석환 선생이 불국사에 기증한 유물을 전시한 공간이 차례로 이어진다.
신라 천년의 역사 속에서 꽃피웠던 불교 예술의 진면목을 들여다보자."
명소,경주 원성왕릉(괘릉) ,괘릉 원성왕 통일신라시대 문화유적 신라 역사 왕,경북 경주시 외동읍 괘릉리 산 17,,,"관람시간 : 정해진 관람시간 없음?
관람료 : 무료?
문화관광해설시간 : 10:10-17:00?
주차정보 : 원성왕릉 주차장(괘릉리 621, 무료) 이용","괘릉은 신라 제 38대 원성왕(785~798)의 능이다.?
괘릉이라는 별칭은?왕릉이 조성되기 이전에 연못이 있어 유해를 수면상에 걸어 안장하였을 것이라는 속설에 따라 붙여진 이름으로,‘걸어놓은 능’이라는 뜻이다.
왕릉 앞 석상들 가운데, 마주보고 있는 무인상 한 쌍이 이국적인 외모로 깊은 눈, 넓은 코, 숱이 많은 수염 등 서역인의 모습을 하고 있어 국제 무역의 중심지로 당시 신라를 떠올리면, 무인석의 모델이 무역을 위해 신라에 왔다가 눌러 살게 된 서역인으로 추정하고 있다.

옆에 서 있는 문인상은 당시 세계를 주름잡는 당당한 신라인의 모습을 , 무덤 앞에 사자상 두 쌍은 몸이 정면을 보고 있지만,
고개를 돌려 시선이 각각 동서남북을 향해, 왕의 무덤을 지키는 수호상으로 본분에 충실한 모습이라는 생각이 든다.

신라인의 치밀하면서도 여유 있는 해학적 면모를 엿볼 수 있는데, 봉분 주변에는 십이지상을 새긴 둘레돌을 둘렀고, 주위에 수십 개의 돌기둥을 세워 울타리를 만들었다."
명소,동리목월문학관,김동리 박목월 동리목월문학관 경주의예인 작가 문학 책,경상북도 경주시 불국로 406-3 (진현동),054-772-3002,http://dml.gyeongju.go.kr/,"관람시간 : 09:00-18:00(동절기 17:00까지)
휴관일 :?매주 월요일, 1월 1일, 설 및 추석 당일
관람료 : 성인 1,500원 / 청소년 및 군인 1,000원 /어린이 500원
주차정보 : 전용 주차장 이용","우리나라를 대표하는 문인 김동리 소설가와 박목월 시인을 주제로 한 전시관으로 불국사 인근에 자리해있다.??
지난 2006년 건립되었으며, ‘동리관’과 ‘목월관’이 있는 본관, 그리고 ‘신라를 빛낸 인물관’이 있는 별관으로 구성된다.

한국문단의 거장 김동리 선생은 경주가 고향이다.
‘무녀도’와 ‘등신불’, ‘을화’ 등 걸출한 그의 작품 속에서 경주를 만날 수 있다.
선생은 무녀도를 개작하여 만든 장편 소설 ‘을화’로 노벨문학상에 노미네이트되기도 했다.

김동리 선생과 함께 또 한명의 경주 출신 문학가가 있다.
청록파 시인의 대표주자인 박목월 선생이다.
그는 자연의 아름다움을 노래하고, 생명의 원천을 궁리하는 아름다운 작품들을 남겼다.

전시관에는 두 선생이 생전 작품 활동을 했던 서재를 재현하였고, 그들의 작품 세계를 알찬 전시콘텐츠로 소개하고 있다."
명소,민속공예촌,민속공예촌 공예인 마을 체험,경상북도 경주시 보불로 230 (하동),054-746-7270,,"이용시간 : 09:00-18:00(동절기 17:00까지)
입장료 : 무료
주차정보 : 민속공예촌 주차장(보불로 230, 무료) 이용","신라 때부터 내려오는 공예기술을 보존하고 계승하기 위해 토함산 기슭에 지난 1986년 민속공예촌이 조성되었다.
흩어져 있던 경주의 장인들이 한 곳에 모여 전통 공예를 계승하고 또 새로운 길을 개척하고 있다.

기와집과 초가 등 45동의 건물이 마을을 이루고 있는 공예촌 자체의 분위기가 고즈넉해 둘러볼 맛이 난다.
유기공방, 칠보공예 등의 금속공예와 청자, 백자, 토기 등의 전통도예, 목가구, 전통장 등의 목공예품까지 다양한 전통공예품을 만날 수 있다.

대부분의 공방이 상설 전시 및 판매를 겸하고 있고, 체험을 진행하는 공방도 많다.
민속공예촌 내에는 제2의 석굴암이라 불리는 신라역사과학관도 자리하고 있으니 함께 둘러볼 것을 추천한다."
명소,국립경주문화재연구소 천존고,국립경주문화재연구소 학술연구 유물 보존 지식 연구소,경상북도 경주시 불국로 132 (마동),054-777-8847,http://www.nrich.go.kr,"관람시간 : 09:-18:00(점심시간 11:30-13:00)
관람료 : 무료
주차정보 : 전용 주차장 이용","‘천존고’는 신라 시대 왕실의 보물창고였다.
삼국유사에 따르면, 신문왕이 동해에서 세상의 풍파를 잠재우는 피리 만파식적을 얻은 뒤 천존고에 보관하였다고 전한다.

경주를 기반으로 신라 역사의 발자취를 찾는 국립경주문화재연구소에서 지난 2018년 소장유물을 보관하는 수장고이자 전시공간인 천존고 문을 열었다.
천존고는 복권기금을 지원받아 지하1층 지상3층의 한옥형 건물로 지어졌다.
내부에는 일반수장고 4실, 특수수장고 1실, 석재수장고 1실을 완비해 출토유물에 대한 보존과 관리 환경을 개선하였다.

또한, 연구소 소장유물의 열람 공간, 출토 유물 전시공간을 함께 갖추었다.
1층의 출토유물 전시열람실은 누구나 관람 가능하도록 개방되어 있다.
현재(2019년 11월 기준) 1층 전시실에서는 ‘덕업일신 망라사방’ 전시가 마련되어 있다.
신라 역사의 전개과정과 문화의 발전상의 이해를 돕고자 기획된 전시이다.
연구소가 직접 발굴한 신라 시대 유물 중 엄선된 200여 점을 전시하며, 특히 현존하는 신라 석비 중 가장 오래된 비인 ‘포항 중성리 신라비’를 만날 수 있다."
명소,추억의 달동네,추억의달동네 응답하라7080 세대공감 가족여행 마을,경상북도 경주시 보불로 216-8 (하동),054-748-5002,http://www.daldongnae.co.kr/,"관람시간: 매일 09:00 - 19:00
관람료: 성인 7,500 / 경로,국가유공자,장애인,군인 등 6,500 / 청소년 6,000 / 어린이 5,000
※경주시민 관람료 30% 할인

주차정보 : 전용주차장, 민속공예촌 주차장(보불로230, 무료) 이용","어제 우리의 이야기는 오늘 역사가 되었고, 오늘 우리의 이야기는 내일 또 한 페이지의 역사가 된다.
불국사와 멀지 않은 곳에 아버지, 어머니 대의 역사를 담은 근대사 박물관 '추억의달동네'가 있다.?

추억의 달동네에서는 1970~80년대의 생활상을 재현해놓은 콘텐츠를 접할 수 있다.
지금은 쓰지 않는 낡은 라디오, 그것을 고치는 전파상, 골목 점빵, 초등학교 아닌 국민학교 교실까지.
근래 반세기 우리네 생활상을 그대로 옮겨 두었다.
추억의 간식 달고나 체험, 추억의 교복체험 등 다양한 체험프로그램도 마련되어 있다."
명소,신라역사과학관,신라역사과학관 제2석굴암 첨성대 과학 문화유산 석굴암 역사 박물관,"경상북도 경주시 하동공예촌길 33, 신라역사과학관 (하동)",054-745-4998,http://www.sasm.or.kr/,"관람시간 : 09:00-17:00
휴관일 : 매주 월요일
관람료 : 성인 5,000원 / 학생 3,500원
주차정보 : 전용 주차장 이용","제2의 석굴암이라 불리는 곳, 신라역사과학관이 민속공예촌 내에 자리한다. 석굴암 관람 전에 필수로 들러야 하는 곳이다.
문화재 보호를 위해 유리벽이 설치되어 있어 석가탄신일 당일을 제외하고 우리는 석굴암 내부를 볼 수 없다. 신라 불교미술의 정수라 불리는 본존불의 아름다움은 유리창 안에서도 빛나지만 과학적으로 지어진 석굴 내부 곳곳을 둘러볼 수 없어 아쉬운 마음이 든다.
신라역사과학관은 일제의 잘못된 복원으로 이끼, 습기와 전쟁을 치르고 있는 석굴암 본존불에 대한 안타까움이 컸던 관장이 사재를 털어 석굴암의 연구 자료를 모으고 모아 전시를 구성한 것으로 알려졌다.

신라역사과학관에서는 선조들의 놀라운 과학기술과 건축기법의 산물인 문화유적을 세세하게 뜯어볼 수 있다.
주요 전시콘텐츠는 첨성대와 석굴암의 모형 전시물이다. 1500년 동안 단 한 번도 무너지거나 크게 흔들림 없이 제 자리를 지킨 첨성대의 구조를 세밀하게 공부할 수 있는 1/10 첨성대 모형이 1층 전시실에 자리해 있다.
1/5 석굴암 모형을 필두로 한 지하전시실에는 혀를 내두를 정도로 정교하게 짓고, 세밀한 조각까지 곁들여진 석굴암 내부 곳곳을 살펴볼 수 있도록 석굴암을 해부하듯 전시해 두었다.
전시를 좀 더 풍부하게 이해하려면 매주 주말 오전 10시와 오후 2시에 진행하는 상설 해설 프로그램을 이용해보자."
명소,석굴암,석굴암 유네스코 세계문화유산 신라건축 최고 걸작 불교 예술 신라 역사 수학여행,경상북도 경주시 불국로 873-243 (진현동),054-746-9933,http://seokguram.org,"관람시간 : 06:30-18:00(3월 중순~9월)/ 07:00-17:30(2월~3월중순, 10월)/ 07:00-17:00(11월-1월)
휴관일 : 연중무휴?
관람료 : 성인 6,000원 / 청소년,군인 4,000원 / 어린이 3,000원
주차정보 : 석굴암 공영주차장(진현동 973-18, 유료) 이용","석굴암은 석굴사원이다.
석굴암 이전에도 석굴사원은 있었지만 대부분 작은 자연 석굴을 이용하거나 바위를 깎아 굴을 만들었는데, 석굴암은 부처를 모시기 위해 치밀한 설계로 건축한 인공석굴이다.
천장 돔이 한 치의 어긋남 없이 밸런스를 맞출 수 있도록 돔을 이루는 돌 사이사이에 돌못을 수평으로 끼워 넣어 무게 균형과 안정감을 해결했다.

탄탄한 인공돔 아래의 원실(주실)에는 신라 불교미술의 정수를 온 몸으로 보여주는 본존불이 안치되어 있다.
웅장한 규모이지만 한없이 자애롭고 온화한 표정은 말로 표현할 수 없는 감정을 불러일으킨다.
본존불 바로 뒷면에는 세밀한 조각이 돋보이는 십일면관음보살상이 있고 돔 둘레에 작은 감실을 만들어 10개의 불상을 모셨다.
가장 앞줄의 좌우 불상은 도굴꾼들에 의해 사라지고 8개의 불상만이 남아 있다.
감실 아래 둘레에는 앞쪽에 천부상과 보살상 4기, 뒤쪽에는 십대제자상이 새겨져 있다.
각기 다른 표정과 자세를 하고 있어 생동감이 넘친다.

석굴암은 원실(주실)앞에 사각형의 전실이 붙어 있는 구조이다.
전실과 원실(주실)을 연결하는 통로에 사천왕상 4기가 있고 전실에는 역동적인 금강역사 2기와 불법을 수호하는 여덟 신 팔부신중이 새겨져있다.
하나같이 세밀한 솜씨다.
불국사와 함께 지난 1995년 유네스코 세계문화유산에 우리나라 최초로 등재되었다."
명소,불국사,불국사 유네스코 세계문화유산 불교미술 신라 건축기술 예술 역사 수학여행,경주시 진현동 산15,054-746-9913,http://www.bulguksa.or.kr/,"관람시간 : 07:00-18:00(3월~9월)/ 07:00-17:30(10월)/ 07:30-17:00(11월-1월, 2월 17:30까지)
휴관일 : 연중무휴
관람료 : 성인 6,000원 / 청소년,군인 4,000원 / 어린이 3,000원
주차정보 : 불국사 정문주차장(진현동 산70-1, 유료), 불국사 공영주차장(불국로 873-243,유료) 이용","불국사는 지난 1995년 석굴암, 서울의 종묘, 합천 해인사의 팔만대장경과 함께 우리나라에서 가장 먼저 유네스코 세계문화유산에 등재되었다.
경주여행을 한 번도 오지 않은 사람은 있어도 경주에 와서 불국사와 석굴암을 보고 가지 않은 사람은 없을 것이다.
그만큼 우리나라를 대표하는 걸출한 문화유산이다.

불교를 나라 신앙으로 믿었던 신라인들은 그들이 해낼 수 있는 최고의 건축 기법과, 최고의 노력과, 최고의 정성으로 ‘부처님의 나라‘ 불국사를 건설했다.
불교교리를 사찰 건축물에 잘 녹여내 이상적인 가람 배치를 이루고 있다.

목조건축에서 쓰인다는 ‘그랭이 기법’으로 잘 짜여 진 가구식석축(보물제1745호)이 부처님의 나라를 떠받치고 있다.
석축 위에 범영루라는 누각이 있는데 불교세계의 중심에 있다는 수미산 정상을 의미한다.
이 천상의 세계로 오르는 계단이 청운교와 백운교(국보제23호)이다.
청운교와 백운교를 올라 자하문을 지나면 석가모니 부처를 모신 대웅전과 마주할 수 있다.
양 쪽에 대웅전을 호위하듯 선 다보탑(국보제20호), 석가탑(국보제21호)과 함께.

대웅전 서편에는 서방 극락정토의 영역, 극락전이 있다.
극락전 영역으로 오르는 계단은 청운교 백운교와 함께 국보로 지정된 연화교와 칠보교(국보제22호)이다.
이 다리를 올라 극락세계의 정문인 안양문을 지나면 금동아미타여래좌상(국보제27호)을 모신 극락전과 만나게 되는 구조다.

두 곳의 주요 법당 외에도 강당건물인 무설전, 관세음보살을 모신 관음전, 진리의 빛으로 어둠을 쫓는다는 금동비로자나불좌상(국보제26호)을 모신 비로전이 조화롭게 배치되어 있다."
명소,경주 이견대,경주이견대 만파식적 평화의피리 동해안 오션뷰 경치,경주시 감포읍 동해안로 1480-12,,,"관람시간 : 정해진 관람시간 없음
관람료 : 무료
주차정보 :?전용 주차장 이용","신문왕이 아버지 문무왕을 기리기 위해 감은사를 지을 때였다. 감은사 앞바다에 작은 산(섬) 하나가 절 쪽으로 왔다 갔다 하는 기이한 일이 벌어졌다.
왕이 일관 김춘질에게 점을 치게 했더니, 바다의 용이 된 선왕이 나라를 지키는 보배를 주려 한다며 해변으로 가면 값진 보물을 얻을 것이라 했다.
왕이 이견대에 올라 바다 쪽을 보니 거북이의 머리와 같은 산 위에 대나무 한 그루가 있는 것을 발견했다.
대나무는 낮에는 둘이 되고 밤에는 합하여 하나가 되었다. 이튿날 대나무가 합하여 하나가 되니 천지풍파가 일주일이나 계속되었다.
이후 물결이 잔잔해지자 왕은 배를 타고 산으로 가서 바다용에게서 대나무를 받았다.
왕이 용에게 대나무가 갈라지고 또 합해지기도 하는 이유가 무엇이냐 물으니, 한 손으로 치면 소리가 없지만 두 손으로 치면 소리가 나는 것과 같은 이치라며 대나무로 피리를 만들어 불면 천하가 화평할 것이라고 말했다.?
세상의 온갖 거친 파도를 고요히 잠재우는 피리, 만파식적은 그렇게 신라의 보물이 되었다.

신문왕이?신라의 보배 '만파식적'을 얻었다고?알려진 전망누각 '이견대'에 들러보자.?
봉길리 앞바다의 문무대왕릉을 한 눈에 내려다 볼 수 있고, 이 곳에서 맞이하는 일출 또한?아름답다."
명소,"전촌 용굴(사룡굴,단용굴)",동해안 일출 촬영 포토스팟 경주용굴 전촌용굴 경주사룡굴 경주단용굴 핫플레이스,경상북도 경주시 감포읍 장진길 39,,,"전촌항에서 용굴가는 법 : 전촌항 공용주차장 인근의 감포깍지길 해안데크로드 이용
소요시간 : 사룡굴까지 도보 약 10분 소요
관람시간?: 정해진 관람시간 없음
관람료 : 무료
주차정보?: 전촌항 공용주차장 이용","경주 감포에 파도와 시간이 만들어낸 자연 조각품이 있다. 해식동굴 ‘용굴’로 전촌항 인근의 해안가에서 만날 수 있다.
사룡굴과 단용굴 두 곳이 있는데, 이름에서 유추할 수 있듯 용에 관한 설화를 품고 있다.
사룡굴에는 동서남북의 방위를 지키는 네 마리의 용이 살았고, 단용굴에는 감포 마을을 지키는 용이 한 마리 살았다는 이야기가 전한다.

용이 드나들었을 법한 통로가 보이는 두 동굴은 감포읍의 스토리텔링 걷기길인 ‘감포깍지길’ 제1, 8구간 코스의 경유지이고, 동해안 트레킹코스 ‘해파랑길’ 11구간을 걷다 보면 만날 수 있는 경관 포인트이기도 하다.
최근까지 군사작전지역으로 일반에 공개되지 않던 곳인데, 해파랑길이 조성되기 시작하면서 해안가를 따라 목재 데크 산책로가 조성되어 용굴(사룡굴)에도 어렵지 않게 닿을 수 있게 됐다.

이곳은 알음알음 일출명소로 각광받는다. 겨울철(12월-1월 중순)에 찾으면 동굴 사이로 떠오르는 해를 함께 사진에 담을 수 있다.
사룡굴 바로 인근에 단용굴이 자리하는데 북쪽 방향으로 해안가를 따라 바위 위를 타고 넘어 가야 찾을 수 있어 접근이 쉬운 편은 아니다."
